2006^"It's the next iteration of the burgeoning self-help industry: teaching people the obvious. After the success of do-it-yourself books and TV shows that offer expert advice on everything from baking your own wedding cake to remodeling a four-story home, a number of new Web sites are hoping to make money sticking with the basics. On eHow.com, one of the most popular topics is ""How to Boil an Egg"" -- broken down into six steps of written instructions. Videos at ViewDo.com, launched this summer, address such matters as how to peel and slice an apple. WikiHow.com provides a written tutorial on playing ""Hide and Go Seek."" (Step Three: ""Determine who will be 'It.'. . . Use 'One Potato, Two Potato' or similar method."") In many cases, the obvious is proving popular. On VideoJug, a lesson in ""How to Brush Your Teeth"" ranks well above ""How to Make Chicken Jalfrezi"" on the site's ""Most Viewed"" list. The site's video on ""How to Fold a T-Shirt in Two Seconds"" has been viewed nearly 40,000 times. The current version is a seven-step, 850-word guide, with five ""warnings,"" including one about peanut allergies, and 13 additional ""tips,"" such as ""spread peanut butter on both bread slices"" to prevent a ""jelly breach."""
2006^"""It's such a mess because the [entertainment companies] have all of these valuable assets that are just locked up with so many people who need to sign off on them,"" says YouTube Chief Executive Chad Hurley. ""I don't know what it requires, if the government needs to be involved,"" Mr. Hurley laughs. ""I don't know."" Clips from TV shows present similar copyright challenges. A show such as the hit medical drama ""ER,"" for example, has dozens of rights holders. Time Warner Inc.'s Warner Bros. owns the majority of the show, with co-creators Steven Spielberg and Michael Crichton having minority stakes. The studio licenses ""ER"" to General Electric Co.'s NBC Universal, Time Warner's Turner Broadcasting System for cable repeats and to local stations for weekend airings. Then there are the actors in every episode and details such as the music, which in most cases is purchased with broadcast rights only. Sorting out this rat's nest can take years. It took NBC Universal more than two years, for example, to clear the rights necessary to make the first two seasons of ""Miami Vice"" available on DVD. YouTube's challenges parallel those stirred up by virtually every new entertainment medium to come along in recent years, including DVDs, digital tracks sold by Apple Computer Inc.'s iTunes online music store, satellite radio, cellphone ring tones and online music subscription services. ""It's almost like technology has pushed far beyond the business practices and the law, and now everything needs to kind of catch up,"" says Chris Maxcy, YouTube's business development vice president."
2006^"David Letterman's raw, heartfelt post-9/11 monologue? Removed at the request of CBS. Whatever Mr. [Bill Simmons] billed as ""the second greatest YouTube clip of all-time unless you're a Yankee fan""? Gone -- Major League Baseball's new-media arm objected. The trailer for ""Karate Kid III""? Removed for violating YouTube's terms of use. A clip from the ancient proto-reality-TV show ""Battle of the Network Stars""? Ditto. A clip of great baseball fights from ESPN, Mr. Simmons' employer? Going, going, gone. YouTube is ingenious. It's a pleasure. In some cases it's clearly been a boon for content creators. (Take the ""Saturday Night Live"" skit ""Lazy Sunday,"" an early YouTube favorite now available from NBC, or OK Go's video for ""Here It Goes Again,"" still available on YouTube.) There is genuinely popular material on it that isn't violating copyright, a claim that was hard to believe when made by Napster and its ilk. (Take this quietly haunting clip, seen more than 3.5 million times.) It can be argued that it serves a social good. (The FBI and the Los Angeles Police Department are investigating two officers for allegedly beating a suspect last summer -- in large part because of a video that's been seen hundreds of thousands of times on YouTube.) Certainly it's become a media force in its own right. (The Republicans might still control the Senate if not for Virginia Sen. George Allen's ""macaca"" remark, widely disseminated on YouTube.) Music videos don't belong on YouTube -- they're entire works of art in their own right, and a market for them exists. (Witness iTunes.) But beyond that, where's the harm? It's risible to suggest that content owners are hurt by videos of teenagers lip-synching to hip-hop songs, that the market for sports DVD is destroyed by fans being allowed to relive a team's great moment, or that artists reusing footage of some famous televised event destroys interest in documentaries. Mr. Letterman's post-9/11 monologue resonates for Mr. Simmons and others five years later -- shouldn't it be available online? I couldn't find it; a CBS spokeswoman said she doesn't think it's available. It should be: It's part of our common culture, along with those big sports moments, bits of televised history and famous TV moments. Isn't there some social value to making these bits of video simply and easily available for anyone and everyone to view, reinterpret and comment on?"
2006^"At issue is the widespread presence of copyright music and video content on MySpace. In the suit, filed in U.S. District Court for California's Central District, Vivendi SA's Universal dismisses the frequently used label ""user-generated content"" -- alleging that much of the material on MySpace is stolen from copyright holders. Universal executives have been outraged by the leak. In a recent interview, Antonio Reid, chairman of Universal's Island Def Jam Music Group, said next week's debut of the Jay-Z album would likely be ""devastated"" by the leaks. ""I'm sure it's cut into our sales, and not by a small amount,"" Mr. Reid said. ""Even if it [sells] a million units it's not what it should have been."""
2006^"Comedy Central, part of MTV Networks, has bought the TV and digital rights to the animated series, ""Lil' Bush: Resident of the United States,"" and will co-produce it with Amp'd Mobile and the show's creator Donick Cary, a TV writer who has written for ""Late Show with David Letterman"" and ""The Simpsons."" Comedy Central plans to air the half-hour show weekly beginning next summer during the popular 10 p.m. to 11 p.m. time slot, possibly right after ""South Park"" and before ""The Daily Show with Jon Stewart."" ""Lil' Bush"" will no doubt raise the profile of Amp'd. Comedy Central, however, says its decision to air ""Lil' Bush"" wasn't influenced by MTV Networks' ownership in Amp'd or Messrs. Messrs. [Phillippe Dauman]'s and [Thomas Dooley]'s past investment in the carrier. ""Washington is like a school yard,"" full of petty and juvenile behavior, says Mr. Cary, whose studio in Bulgaria does the animation work. Mr. Cary presented clips of ""Lil' Bush"" to Comedy Central while producing another show for the channel called ""The Naked Trucker and T-Bones"" that's scheduled to air in January."
2006^"Teenagers have begun posting audition tapes on YouTube and MySpace for a series called ""The New 22,"" which its creator, production company Evolution Entertainment describes as a younger version of ""The View."" The casting call was placed through koldCast.com, a new site launched by Irvine, Calif., product-placement company EMmerzion Worldwide to let actors post online auditions. In exchange, the company gets dibs on selling product placements in movies and TV shows that use actors found through the service. Jessie Bronfman, a 25-year-old Woodmere, N.Y., resident who wants to be a TV host, has applied online for a video-jockey position and is hoping to score a role in ""The New 22."" She spends at least an hour a day searching for new online auditions through Craigslist, YouTube and Google, then cultivates her online network of friends who vote for her in video contests and help her get higher ""hit counts"" for audition videos."
2006^"For advertisers, Web television delivers a dream audience of dedicated fans. ""The fact they've gone and sought it out [online] indicates they're pretty loyal, passionate viewers of a show,"" says Mark Simmons, national manager of advertising strategy and media for Toyota, which advertises on many of Disney's online shows. ""It's a step beyond appointment viewing."" Toyota says it's too early to tell how the online shows will affect the company's relationship with Disney, or its regular TV advertising. The car maker also won't disclose what it's paying for the online ads. Disney hasn't set regular rates for the shows, but they are likely to be considerably less than the $550,000 to $650,000 the network charges for a 30-second ad on the broadcast version of ""Lost"" or ""Desperate Housewives."" Fans make the same argument. For instance, an avid viewer of the mystery series ""Veronica Mars"" has created an interactive map showing locations from the program. Why? ""It's another way of generating publicity for 'Veronica Mars,' and we're constantly on the bubble in terms of ratings,"" says the map's creator, a 40-year-old college professor who prefers that her name not be used."
2006^"New York -- EVERYBODY'S TALKING about YouTube -- and not always nicely, either. Doug Morris, who runs Universal Music, gave a speech the other day in which he proclaimed that the 19-month-old online video-sharing Web site owes his conglomerate ""tens of millions of dollars"" for allowing copyrighted music videos to be posted without permission. Mr. Morris's shot across the bow was quickly followed by the announcement that Warner Music, Universal's smarter competitor, has struck a deal allowing YouTube, which receives 100 million hits a day, to show its videos in return for a chunk of ad revenue. Says Warner Chairman Edgar Bronfman Jr.: ""Consumer-empowering destinations like YouTube have created a two-way dialogue that will transform entertainment and media."" In recent months, jazz-loving friends have been sending me YouTube links to videos by Louis Armstrong, Duke Ellington and other celebrated artists, most of them drawn from films of the '30s and '40s and TV shows of the '50s and '60s. Some of this material is available on DVD, but most of it lingered in limbo until Chad Hurley and Steve Chen, YouTube's co-founders, made it possible for anyone with a computer to post and view video clips at will. Fascinated by the links unearthed by my friends, I spent the better part of a long weekend trolling through YouTube in search of similar material. When I was done, I'd found hundreds of videos, some extremely rare and all compulsively watchable, posted by collectors from all over the world."
2007^The first devices for moving Internet content to TVs from PCs, sometimes called media adapters, haven't sold well so far. PCs adapted for playing downloaded videos on TVs also haven't made much headway, despite the high-profile backing of Intel Corp., under an initiative called Viiv. Rivals, by contrast, see Web-delivered video as a way to neutralize the cable industry's ability to deliver video on demand. AT&amp;T Inc., for example, at the CES plans to show the latest version of Homezone, a combined satellite-TV and Internet-video service introduced last year. It offers a set-top box that receives EchoStar Communications Corp.'s Dish Network service and downloads video content off the Web. DirecTV Group, another large U.S. satellite-TV operator, has developed a high-definition set-top box that allows subscribers to retrieve photos and music from computers using Viiv technology. Sony Corp. allows users of the PlayStation 3 to do the same thing, though with a shorter menu. Users now can only get trailers and game demo movies from its so-called PlayStation Store on the Web. But the new game console comes with a browser that allows people to roam to sites such as YouTube and watch its videos on TV. Nintendo Co.'s Wii device can also surf the Web for videos or other content, but the company hasn't emphasized that particular use.
2007^"The online show, called ""News at Seven,"" uses an automated computer program to comb online news outlets for major stories of the day and to pair them with video and still photos culled from sites like Google Images and YouTube. The newscast is delivered by an avatar -- a digital representation of a person."
2007^"One late afternoon last week, seven writers and editors were slouched around the writing-room at CollegeHumor.com's Manhattan office, bouncing around ideas for their next original online comedy video short. ""A meat-based poker game called High Steaks Poker?"" one chimes. Lame, is the collective verdict. A ""Miami Vice""-inspired re- enactment of the game ""Where in the World is Carmen Sandiego?"" Bingo. CollegeHumor's expansion into video programming is a harbinger for what Barry Diller's IAC has in store for the rest of its Internet media conglomerate, a portfolio of some 65 brands. While user- generated content, from pet-tricks to video rants, has captured much of the buzz around video online to date, Mr. Diller is betting on a different formula: featuring professionally produced, ad-supported video clips geared toward highly targeted audiences. In addition to kicking off CollegeHumor's original content, Mr. Diller is launching 23/6, a multimedia comedy news site whose name is a spoof on the phrase ""24/7."" He's also adding original online-only content to HSN.com, the home shopping network Web site. That's not stopping Mr. Diller from making an aggressive push into an area he knows well. IAC's president of programming, Michael Jackson, poached some TV talent to run 23/6, which is a partnership with the Huffington Post, a left-leaning news and opinion site. The site, with a launch planned for March, will be edited by Daley Haggar, a comedian and writer who has worked on shows like Comedy Central's ""South Park"" and NBC's ""The Apprentice."""
2007^In a demonstration, ScanScout's system displayed an ad for a sports- car brand at the bottom of a video clip as the people on screen were discussing that type of car. Consumers can click on the ad to pause the playback and see a video commercial, or be taken to the advertiser's Web site. By analyzing a video's content, ScanScout can help companies steer clear of subject matter and language that make them uncomfortable, potentially increasing the confidence of traditional advertisers in buying ads on amateur videos. It can also place multiple ads on a given video clip as what is being discussed changes, something that could let Internet companies tap additional ad dollars. ScanScout is already gaining some traction with customers. Online video site PureVideo Networks Inc. of El Segundo, Calif., says it plans to begin testing ScanScout, probably with standup comedy videos on its StupidVideos.com site. Blip Networks Inc. of New York has tested ScanScout on its blip.tv video site since the fall, and Chief Executive Mike Hudack says he believes it is more effective than just matching ads with the descriptive information the videos' creators supply. ScanScout co-founder and President Waikit Lau says his company lets advertisers pick categories of videos they want to target, in addition to having their ads appear alongside specific key words. He says ScanScout will at least initially tap nonvideo ads, such as graphical and text ads, to appear alongside videos to compensate for any shortage of video advertisements. And Mr. Lau says Web sites can run their high-priced ads as well as the ones from ScanScout, since its ads appear only intermittently during the clips.
2007^"HOW TO FIND IT: On YouTube.com, search for ""Nosferatu rescore"" for ""Nosferatu,"" ""Voyage threetails"" for ""Le Voyage Dans la Lune"" and ""JynxHauser"" for Ms. [Jessica Schreiber]'s videos. ""Nosferatu,"" the 1922 Muranu vampire classic, is one of the most frequently re-scored by professionals and amateurs alike. The most interesting amateur ""Nosferatu"" rescoring on YouTube is a series that adds sound effects -- footfalls, a creaking coffin lid -- and a modern-classical score that includes synthesizers and the occasional electric-guitar chord. The result prompts viewers to watch the clips as they would a modern horror movie."
2007^"Such systems aren't foolproof, though. A recent search with the keywords ""[Britney Spears] and Paris"" turned up a video on Revver purporting to show ""Paris Hilton nude on the beach in st tropez."" The short clip didn't include any video of the celebrity heiress. In fact, it was an otherwise blank screen with a bit of text; alongside the video box was a description consisting of about 200 misleading keywords ranging from sexually explicit terms to ""ESPN"" and ""Microsoft."" After the 28-second clip, there suddenly appeared an ad for a Palm Inc. product. ""This is totally misleading,"" acknowledged Revver's founder and chief executive, Steven Starr. But ""this happens very, very infrequently,"" he added. Revver removed the clip yesterday after a reporter for this newspaper pointed it out. A Palm spokeswoman said she ""contacted Revver to express our surprise and displeasure, and clearly Palm and Revver agreed that the content was inappropriate."" A clip titled ""Hot Blonde Tells You How She Wants to . . .,"" which directed users to a site telling ""How to Make Buckets of Cash"" had garnered almost 500,000 views by yesterday and ascended to the No. 6 slot on the ""Top 10"" list featured on Google Video. The video's creator attached more than 100 misleading keywords, including sexually explicit terms and ""Harry Potter."" It Is possible that some users were actually interested in seeing the site's pitchwoman, but it Is likely that others were misled into watching it."
2007^"IN THE LATEST sign of the influence of YouTube-style videos, Steven Bochco, the creator of hit TV shows like ""L.A. Law"" and ""NYPD Blue,"" is trying a new medium with a series of short, unscripted videos on the Web. Many of the anecdotes have sexual themes, including an entire category devoted to ""my first time,"" and sometimes feature off-color jokes and commentary. Mr. Bochco says he was looking for a topic that young people would be ""universally attracted to."" ""It's the antithesis of what I'm doing in my day job,"" Mr. Bochco says. ""It's just challenging to try and figure out in a different medium, that really has a different expectation."""
2007^"The first episodes harken back to proven hits, from the high-school melodrama of Fox's ""The O.C."" to the typecasting of the horror movie ""Scream."" A more direct precedent might be Lonelygirl15, the extremely popular YouTube personality who seemed to hint at an eerie family backstory in her bedroom videos (which turned out to be concocted by a pair of filmmakers). ""Prom Queen"" gets off to a provocative start. A young woman wakes up in the grass, distraught and in her underwear. Inside, she contemplates a handful of pills and discovers a video camera in her bedroom. When she says ""Oh, God,"" her British accent comes as a surprise -- until we learn, in episode two, that she's an exchange student who is fascinated by the prom."
2007^"CBS could announce as early as today agreements which will make available to these portals previously aired full episodes of shows such as ""NCIS,"" ""CSI: Crime Scene Investigation,"" the ""Evening News with Katie Couric"" and certain sports programming. Aside from MSN, a unit of Microsoft Corp., and AOL, a unit of Time Warner Inc., the New York media company is also expected to announce an agreement with Joost, an online-video service founded by the creators of the Internet-telephone service Skype. CBS will become the first broadcast network to sign with Joost. CBS's increased distribution could give it ammunition if it tries to negotiate a favorable deal with YouTube, the biggest video site on the Web with more than one billion videos streamed each month. CBS has tried to strike a broad, multiyear licensing deal with YouTube, but talks have fallen apart over such matters as licensing fees and the forcefulness of YouTube's efforts to police pirated clips."
2007^"The video blog ""Rocketboom,"" for instance, has been delivering three-minute news programs five days a week since October 2004. ""Grammar Girl,"" a popular podcast about proper language usage, gets an update every Thursday like clockwork. That regular schedule is crucial to the podcast's creator, Mignon Fogarty. ""When the shows I listen to don't come out, I get very frustrated,"" she says. Now Ms. Fogarty is exploring new niches. In addition to her own show, she now produces six other advice podcasts featuring other people -- including ""Mighty Mommy,"" about parenting, ""Money Girl,"" about finances, and ""Legal Lad,"" about the law. The network gets about a million downloads a month. Much slicker looking is the video podcast ""Ask a Ninja."" In each episode, a black-clad performer uses questions from viewers to launch comic riffs on the legendary Japanese assassins. In a recent show, a viewer asked, ""Do ninjas write poetry or are they just murderous shadows of death put on earth only to act against mankind?"" Answer: ""Wow, I didn't realize those were the only two options."""
2007^"""We're trying to keep our character palate as balanced as possible,"" says 29-year-old Eric Socolofsky, leader of the three-man creative team behind the site, which he calls a hobby. The unrefined visual aesthetic is meant to have a ""clip art"" sensibility, he says, drawing inspiration from popular online comics like ""Get Your War On"" and ""Red Meat."" Their goal, in part, was to manufacture a new user-generated Internet trend. ""I wanted to try working on a viral Web project,"" says 27-year-old Mr. [Ahmad Saeed], who designed the Quickcomic database. For Mr. Socolofsky, who thought up the concept, Quickcomic is a tool for expression. ""I've taken part in protests, both physically and digitally,"" he says, although these experiences often left him feeling frustrated and unsatisfied. With Quickcomic, Mr. Socolofscy envisioned something ""a bit lighter, a bit humorous and a bit more approachable."" Despite this political aim, early comic creators haven't focused exclusively on political topics. ""I'd say we mostly see people being ridiculous and apolitical,"" says Mr. Socolofsky of the more than 600 comics on the site so far. ""Of the rest, I'd say it leans to the left. But we don't encourage people to express one kind of political view or another."""
2007^"The clips, which run up to 60 seconds long, will assemble memorable moments from the movies, grouped under categories like ""Leia Confronts Vader"" and ""The Lost Limbs"" -- the latter a collection of various characters' limbs getting the chop. One category devoted to a much- maligned lizard-like character from the three ""Star Wars"" prequels urges fans: ""Don't be shy. Here's your chance to edit Jar Jar."" That notion may not resonate with fans who remember Mr. [George Lucas]'s reactions to other attempts to draw on his movies for inspiration. Last year, Lucasfilm sued a Maryland company that was making ""Star Wars""-like light sabers without the proper trademarks. Previously, it sued rapper Dr. Dre for using the booming sound effect that begins Lucasfilm movies to kick off his album ""2001."" And it also sued to block distribution of an animated pornographic movie called ""Starballz"" that featured some ""Star Wars""-like characters. The company says this situation is different. If fans are using ""Star Wars"" material for fun, that's one thing. ""If someone tries to commercialize it, that's where we've drawn the line,"" says Mr. [Jeffrey Ulin]. He says the company has long supported activities like an annual contest for the best ""Star Wars"" movie submitted by a fan; Mr. Lucas will pick this year's winner on Sunday at the ""Celebration IV"" ""Star Wars"" convention in Los Angeles."
