2011^The number of U.S. households that pay for TV service from cable, satellite or phone companies dipped for the first time last year after decades of growth, with 335,000 fewer households paying for service between the first and the third quarters, according to research firm SNL Kagan.
2011^Large Internet properties have been forging partnerships with media companies for years, seeking a steady supply of content to satisfy users' interests in topics as granular as local news and obscure health conditions.
2011^"YouTube proved a powerful catalyst for creativity; it gave the world Justin Bieber (but don't hold that against it!) but also improbable success stories like the Lonely Island, a comedy troupe of three guys in their 20s who parlayed making goofy homemade videos with their buddies into hit albums and gigs on ""Saturday Night Live"" (a show that has made television history by relying on the comic energy of several generations of ambitious 20-somethings)."
2011^"""[...] frankly, 'hundreds' making a living on YouTube isn't enough and in 2011 we know we can and should do more to help our partners grow,"" he wrote. Since launching in March 2007, New York-based Next New Networks has built a platform for developing, packaging and building audiences around original web video programming."
2011^"Sam Schechner Technology and media companies are racing to create Internet-video hits closer to the scale of traditional TV, as consumers start to watch more video on Internet-connected televisions and tablet computers. Shows that have their first appearance--or ""window""--online also can help Internet companies vie for viewers with traditional video distributors, like cable and satellite companies."
2011^YouTube is still in the process of designing the channels and in recent weeks held meetings with Hollywood talent agencies such as Creative Artists Agency, William Morris Endeavor and International Creative Management to discuss the possibility of their clients creating YouTube channels, people familiar with the matter said. In addition to increasing the average time a YouTube user spends on the site, which stands at about 15 minutes a day, the moves are aimed at attracting new ad dollars, including a chunk from the $70 billion U.S. television-ad market, said people familiar with the matter.
2011^The upgrade is part of a broader YouTube overhaul that is in the works, as the video site attempts to broaden its focus from homemade videos to include professional entertainment content and position itself for the rise of Internet-connected televisions that allow people to easily watch online video in their living rooms.
2011^For the bloggers who use these sites, the exchange of copyrighted material and intellectual property--other people's photographs, music, lists of all the amazing things you ate for lunch--isn't just an aspect of the form, it's practically the entire business model. No, the Internet police probably aren't going to be kicking down your door to ask questions about that copyrighted photo of Ke$ha you just posted, but when it's almost as easy to do things the right way, why not at least try? It's a willful ignorance, says Bert Krages, a Portland, Ore., lawyer who specializes in intellectual property issues, and has written Legal Handbook for Photographers:
2011^Michael Green, chief executive of The Collective, the management company that represents show creator Dane Boedigheimer, says items like hats, T-shirts and novelty items--he wants to develop a product as ubiquitous as the singing fish people mounted on their walls several yearsback--are in the works and will go on sale by year end.
2011^"During the July filming for ""First Day,"" a comedy series for teenage girls, a woman with a spreadsheet and a red pen sat in a director's chair carefully checking off boxes. Web shows like ""First Day"" could provide a template for TV's future that harkens back to the era when advertisers not only sponsored but helped to create, cast and script ""soap operas"" and variety shows."
2011^"Many brand advertisers were previously scared off by the large amount of user-generated, lower quality content on YouTube, said David Cohen, an executive vice president at Universal McCann, a media-buying agency owned by Interpublic Group of Cos. But in recent years, YouTube has accumulated higher-quality video and its new channels strategy ""is a clear signal of its commitment to creating immersive and engaging original content,"" he said."
2011^The initiative also is aimed at positioning YouTube for the rise of televisions and cable set-top boxes that let people watch online video in their living rooms YouTube won't abandon the way it has made money--namely, by identifying popular user-generated videos and offering to share ad revenue with the creators, people familiar with the matter have said.
2011^Google has struck deals with media companies such as RTL Group, IAC and News Corp. as well as online-video creators to produce original content for YouTube in the hopes that people will want to watch the Web shows on their Internet-connected TVs, people familiar with the matter have said.
2011^YouTube, which is trying to become a next-generation video provider overseeing free online channels with professional-grade shows, is expected to give some content creators 55% of the resulting ad revenue after YouTube recoups the cash advances it paid them, some of the people said.
2011^"Google Inc. on Friday announced the creation of around 100 online video ""channels"" on its YouTube website that will have new original programming involving celebrities such as such as singer Madonna, rapper Jay-Z, actor Ashton Kutcher and former NBA star Shaquille O'Neal."
2011^Hardcore fantasy fans seeking to immerse themselves in their favorite fictional worlds are swapping tips on how to cook dishes like this grilled snake with fiery mustard sauce from the book 'A Feast for Crows.'
2011^ESPN said Thursday that it has made its flagship cable sports network available live on Apple Inc.'s mobile devices for subscribers to pay-TV service from Time Warner Cable Inc., Verizon Communications Inc. and Bright House Networks.
2012^Ray William Johnson curses constantly, often gives his audience the finger and sometimes dresses up as a penguin, but he is attracting more than five million regular viewers to his twice weekly video commentaries, making him the biggest draw at Google Inc.'s online-video outlet. Mr. Johnson, who spikes his dark-brown hair two inches high, is the poster child for how some performers can harness the viral power of the Web to build a career, bypassing traditional media.
2012^"Coming next to Netflix: ""House of Cards,"" a drama produced by David Fincher and starring Mr. Spacey as an ambitious politician, and a revival of the cult TV comedy ""Arrested Development."" Despite the influx of big-name talent, it's always hard to predict what will catch fire online--a homemade video of a precocious pet or amateur singer can command the kind of viewer numbers that network executives only dream of."
2012^An Internet video seeking to draw attention to fugitive African rebel leader Joseph Kony now stands as the fastest-growing viral phenomenon in Web history, thanks to informal celebrity advocates and young viewers.
2012^At a time when digital-video outlets like Google Inc.'s YouTube are trying to make inroads in the ad market, the annual upfront marketplace has become a barometer of advertisers' appetite for television.
2012^Mr. Lin is one of a number of film and TV writers, directors, actors and producers who are venturing online to build YouTube channels with original scripted content in the form of short films and Web-size series.
2012^Blue-chip advertisers that have bought ad inventory on the new channels include American Express Co., Unilever PLC, and Procter &amp; Gamble Co., which spent an undisclosed amount to dominate the ad space on YouTube's new Spanish-language channels for 12 months.
2012^[...]with TV, YouTube's fast production process and the lower costs of online video means producers can make near-instant changes to their programs in response to viewer feedback. [...]YouTube channel producers say the rapid evolution of their content will eventually allow them to find the best way to attract large audiences for the long term.
2012^The company also said it would do a better job of restricting copyright violators on the Web from participating in Google's advertising network, and that it would take steps to make it easier for users to find and access previews of copyrighted material, such as songs or videos, on the first Web-search results page, rather than having to click on links to other websites.
2012^" David Cohen, executive vice president at advertising agency UM, a unit of Interpublic Group of Cos., said the move by Everyday Health is a ""testament to both the YouTube channel initiative and an acknowledgment that as the media world continues to fracture, the best programs have anchors in multiple media channels,"" meaning both online and in broadcast."
2012^ Last year, marketers spent about $60 billion on television advertising in the U.S., dwarfing the $2 billion spent for online video advertising, according to eMarketer Inc. Many media executives believe a shift is inevitable as the amount of time Americans spend viewing online video has increased, while time spent on watching programs on traditional TV sets has declined.
2012^ In a city with no shortage of studios, YouTube Space is a new hybrid: a slick production facility intended as a talent incubator, where selected YouTube creators will be granted free access to complete projects, hone skills and collaborate with peers in a campus setting.
2012^Ray William Johnson curses constantly, often gives his audience the finger and sometimes dresses up as a penguin, but he is attracting more than five million regular viewers to his twice weekly video commentaries, making him the biggest draw at Google Inc.'s online-video outlet. Mr. Johnson, who spikes his dark-brown hair two inches high, is the poster child for how some performers can harness the viral power of the Web to build a career, bypassing traditional media.
2013^ In a bid to attract more advertising dollars and shift advertiser budgets away from TV, YouTube over the next few years could end up spending hundreds of millions of dollars in cash advances to video producers around the world to create high-quality, original content for YouTube.
2013^ The move would add a new revenue stream for YouTube and its thousands of content partners, and it could potentially help the site lure new video creators who want a subscription model rather than rely only on advertising, these people said.
2013^ German car maker Audi posted three versions of its ad on YouTube and let consumers select which ending should air, while Ford Motor's Lincoln brand started a Twitter campaign that asked people to tweet their most memorable road-trip stories.
2013^" VivendiSA's Universal Music Publishing Group has struck deals with Maker Studios Inc. and Fullscreen Inc., two of the biggest ""multichannel networks""--a new breed of digital entertainment companies that distribute, promote and sometimes produce videos specifically made for Google Inc.'s YouTube."
2013^ Separately, Google's YouTube video website is trying to obtain licenses from music labels to start a paid subscription service for music videos and potentially also for audio-only songs, these people said.
2013^" Michael Hayes, president of digital at ad agency Initiative, a unit of Interpublic Group of Cos, said there is ""downward pressure on advertiser rates due to the sheer volume of options that advertisers have"" through YouTube's rivals."
2013^ [...]YouTube has changed some of its policies to help video creators generate more revenue from their videos, both on and off the site.
2013^ [...]YouTube has altered some of its policies to help video creators generate more revenue.
2013^ The transaction adds Yahoo to the list of established Internet companies, including Google Inc. and Facebook Inc., that have spent $1 billion or more apiece to buy startup companies in hopes of gaining an edge in growth. Yahoo Chief Executive Marissa Mayer's deal for Tumblr gives Yahoo, one of the original big Internet companies, a fast-growing Web service that could fill one of its many holes--namely, the lack of a thriving social-networking and communications hub.
2013^" What's different with ""Some Girl(s)"" is that it marks the first new release to use the Vimeo On Demand platform, which gives filmmakers a generous 90% cut of the revenue generated by the film -- compared with 70% on iTunes, or 50% from a cable operator -- and complete control over pricing and marketing."
2013^ Wall Street Journal reporter Katherine Rosman recently invited YouTube creators and behind-the-camera marketers and brokers to discuss how the creative process can become a business in an . John McCarus, at the advertising agency Digitas, whose clients include Whirlpool and Sprint Is it difficult to convince consumer-product advertisers to invest in advertising on YouTube, a platform with a demographic and content that can be very different from broadcast and cable programming?
2013^" The major YouTube stars were ushered behind back staircases and accompanied by walkie-talkie toting assistants who told teenage girls ""no pictures."" [...]the preponderance of attendees were casual users like Owen and Elliott Desai, 17-year-old identical twin brothers from Minnesota breaking into their first VidCon with 250 business cards printed with their senior picture on it."
2013^" Other mainstream-media companies have launched channels for YouTube, while also putting their cable network programming online, available for pay TV subscribers, a strategy called ""TV Everywhere."""
2014^ Viacom Inc. resolved copyright litigation with Google Inc. over the tech giant's YouTube video site, ending a seven-year legal fight that became a symbol of tensions between media companies that produce content and websites that let users share it.
2014^ Yahoo Inc. is in preliminary talks to acquire online-video service News Distribution Network Inc., a deal that would help Chief Executive Marissa Mayer compete with Google Inc.'s YouTube for viewers and ad dollars.
2014^ South by Southwest's film festival in Austin, Texas, ran an online program from 2004-08, and the Sundance Film Festival, held in Park City, Utah, hosts its first episodic story lab this fall, for writers and creators of content for online platforms and television.
2014^" The company's need for non-movie revenue streams came into sharp relief on Tuesday, when DreamWorks announced a $57 million write-down related to ""Peabody,"" and a first-quarter net loss of $42.9 million, compared with net income of $5.6 million in the year-earlier period."
2014^ Vevo, a joint venture of Universal Music Group and Sony Music Entertainment that owns the rights to stream music videos on ad-supported services like Google Inc.'s YouTube, also is exploring a sale.
2014^" Rich Silverstein, co-founder and co-chairman of ad agency Goodby, Silverstein &amp; Partners, creator of the ""Got Milk?"" and Budweiser Lizards campaigns, says the Facebook video ads will need ""visual seductiveness"" in the first three seconds. Former Apple Inc. Chief Executive Steve Jobs insisted on being involved in the creative process when Apple launched iAd for advertising inside apps in 2010."
2014^ Nathalie Tadena and Suzanne Vranica Maker Looks to Building Brand Beyond YouTube Maker Studios, one of the biggest producers of programming on YouTube, is looking to cozy up to marketers that want to master Web video -- even as the company looks to develop its own consumer brand.
2014^ [...]users must sit through ads, and music fans usually have to pick songs one at a time, rather than entire albums or custom playlists. Besides no ads, users of the new music service on mobile devices are expected to be able to keep playing songs while they use other apps, as well as to store music for offline listening for a short period according to people who have seen preliminary versions of the product.
2014^ The three major label groups, Vivendi SA's Universal Music Group, Sony Corp.'s Sony Music Entertainment and billionaire Len Blavatnik's Warner Music Group have struck deals with YouTube for the new music service.
2014^" Yahoo was the fourth-largest video site, with 52 million viewers, trailing Facebook Inc. and AOL Inc. For ""Community,"" the show's jump to streaming TV brings it that much closer to fulfilling the online chant for #SixSeasonsAndaMovie, a reference to a quote from one TV-obsessed character that turned into a rally cry for fans and cast members."
2014^ YouTube takes a 45% cut of ad sales generated by videos on its network, but video creators don't have to share revenue derived from merchandising or branded entertainment--where a company's products are featured in what otherwise looks like conventional entertainment.
2014^ In what may be another signal that Facebook Inc. wants to take on YouTube, the company has reached out to some of the Google Inc.-owned video site's biggest content producers and encouraged them to test distributing their videos on the social network, say people familiar with the matter.
2014^" The publisher's Running Press imprint will release ""The Pointless Book"" on Tuesday in the U.S. CBS Corp.'s Simon &amp; Schuster has even started an imprint dedicated to YouTube personalities, Keywords Press, in partnership with United Talent Agency."
2014^ Google Inc.'s YouTube may give viewers the option to watch ad-free videos for a fee, according to a top executive at the Internet giant, a big change from the advertising-only approach that turned it into the world's largest online video website.
2014^ Founded by former Hulu Chief Executive Jason Kilar, the company has raised $75 million in venture capital, according to Crunchbase, and is looking to secure programming ahead of a planned launch by the end of the year.
2014^" Figuring out how to show video ads to users will be tricky for Facebook, since the company has indicated that it doesn't plan to run ""preroll"" ads -- the TV-like video ads that run before online videos and are the industry standard."
2014^ Walt Disney Co. is in talks to acquire popular online-video producer Maker Studios for about $500 million, said people with knowledge of the discussions, a deal that could give the entertainment giant better access to a young teen audience whose tastes are shifting to Web-based video.
2014^ Disney plans to use Maker staff and tools to help put its existing content online, as well as to mine Maker's many channels for programs and personalities to exploit through the conglomerate's other businesses, said executive vice president of corporate strategy Kevin Mayer.
2015^" ""Social media is designed to be social, but a lot of people forget that,"" says Ted Murphy, chief executive of Izea, an agency that has helped organize social-media campaigns for Unilever, Walmart, ConAgra Foods and other big brands. In the mid-2000s, former marketing executive Wendy Piersall was struggling to generate revenue with her blogs on mother-related issues, until a post on children's activities in 2007 made the home page of Digg and sent her traffic soaring."
2015^ [...]the only way fans could find NFL content on YouTube was through pirated clips, which are removed quickly, or fan-recorded footage from live games. [...]other websites won't be able to embed YouTube clips from the NFL channel.
2015^ [...]the company -- which built its business by helping manage thousands of YouTube stars -- wants to become more of a youth marketing brand consultancy, and one that is much less YouTube-dependent, says Chief Executive George Strompolos.
2015^" Corrections &amp; Amplifications Including visits via mobile devices, more than half of YouTube's users access the online-video service directly, according to a spokesman for Google Inc. A Business &amp; Tech article Thursday about YouTube's contribution to Google's profits incorrectly said most YouTube users reach the service via links or embedded video players on other sites. Josh Jacobs, chief executive of Accuen, the programmatic-advertising arm of Omnicom Group Inc., says ad buyers want to reach young fans as they build brand ""affinities."""
2015^ [...]big music services start paying the creators of the individual tracks he puts in his mixes, he said, he can't release them to very wide audiences, since he doesn't have time to get clearance for every song himself.\n
2015^ Technology companies including Facebook Inc., Snapchat and streaming-startup Vessel are promising large TV-channel owners better terms for their video programming than Google Inc.'s YouTube, hoping to capitalize on mounting frustration with the Web giant in the entertainment industry. Vessel, which was founded by Jason Kilar, the longtime chief executive of streaming site Hulu, is offering media companies about 70% of the ad revenue for its coming short-form video service, plus a cut of the $3-a- month subscription fee, if Vessel gets the content exclusively when it is first released, people familiar with the discussions say.
2015^ According to research by ad-blocking measurement service PageFair, approximately 5% of Internet users globally used ad blocking tools during the second quarter of 2014, up from around 3% for the same period in 2013.
2015^ Among subscription video services, Netflix Inc. dominates, followed by Amazon.com Inc., Hulu and others that have a strong presence in individual markets outside the U.S. Jonathan Miller, partner at early stage investment firm Advancit Capital and former chief digital officer at News Corp, pointed to important differences between the digital-music industry, where competitors essentially have the same catalog of songs, and the digital-video business, where rivals bid for the choicest offerings. Mr. Verna said there are synergies between music and video entertainment, citing the successful expansion of Apple's iTunes store from selling digital music to also offering movies, TV shows and podcasts.
2015^ Google Inc. and Facebook Inc. are launching gliders and blimps and laying fiber in the ground; cable TV operators are deploying Wi-Fi workarounds; there are now mobile-phone carriers in which Wi-Fi is the default; and cellular technology is the backup.
2015^ If successful, the effort will make Facebook a more serious threat to Google Inc.'s YouTube in online video. [...]Facebook has slotted video ads into users' news feeds.
2015^" Mr. Skogmo, a former clip hunter for shows such as ""Country Fried Home Videos,"" which he described as a ""redneck version of 'America's Funniest Home Videos,'"" saw an opportunity to create a stock footage house of viral videos that could serve as a one-stop shop for media platforms and a business manager for rights holders."
2015^ First and most obvious is that Facebook lacks an established ad revenue model for content producers.
2015^" A YouTube representative helped Elise Strachan, creator of the popular channel ""MyCupcakeAddiction,"" apply for a grant from a joint venture between the Australian government and Google that funds higher-quality online video production."
2015^ Facebook also said it would start sharing ad revenue with video creators in a bid to attract more high-quality videos to the social network and grab a piece of advertisers' television budgets. [...]Facebook today resembles even more closely a younger Google--growing rapidly with enviable profit margins.
2015^ The track record for celebrity games--there are apps out now and in development from singer-songwriter Demi Lovato, rapper Meek Mill and actor Jason Statham--is mixed. Dude Perfect, a group of five men known for sports and comedy videos, released two versions of a self-titled sports game with the help of professional game studios.
2015^ [...]Facebook has relied on technology partner Audible Magic to help it identify unauthorized video content through audio fingerprinting.
2015^" The Federal Trade Commission on Wednesday said Machinima, an early leader in so-called multichannel networks, paid ""influencers"" as part of marketing campaign managed by Microsoft's advertising agency, Starcom MediaVest Group."
2015^" The most impressive entry so far is ""City of Scars,"" a $27,000, 30-minute film that could easily be a template for a low-budget Batman TV series, containing highly believable fights, chases and action sequences, as well as copious philosophizing and moralizing (""Gotham City is sick of Batman's conscience,"" Officer Montoya snarls, ""and so am I!"")."
2015^ According to Vine's parent company Twitter, 200 million people watch Vine content each month globally. [...]Vine's unique format is big on Facebook -- people even create entire pages devoted to compilations of top Vines.
2015^ [...]Wildness plans to release some new proprietary research on this demographic's media and advertising attitudes next week during Advertising Week in New York.
2015^ Linda Yaccarino, NBCU's chairman of advertising sales and client partnerships, declined to share any specifics on the deal, but implied that the company had been naturally headed in this direction given its ongoing embrace of digital media.
