1998^"AOL now dominates cyberspace, and its recent agreement to buy Internet pioneer Netscape Communications Corp. has set the new-media world clucking about the ""C's"" for the coming year. The consensus, based on conversations across the Internet community, is that Mr. Case's three will give way to nine ""C's"" and a ""P"" in 1999: But even if it mauls the mall, electronic commerce faces some ugly facts of the retail world that not even the efficiencies of the Internet can ignore: the difficulty of maintaining margins in vicious price wars, the constant need to feed the marketing machine and the inevitability of competition. Most Internet executives seem positively frantic on this topic: Now that they have gotten your attention, how can they hold on to you? Many say the goal for 1999 will be to increase the number of ""hooks"" online companies can sink into a user. Among them: free e-mail, ""electronic wallets,"" Internet calendars and Web-based date books. That's because, says Julie Wainwright, chief executive officer of Reel.com Inc., an online video seller, many Internet users are still ""samplers."""
1999^Now, in the budding days of online video and tunes, music executives are getting tougher than ever in licensing negotiations. They are trying to prevent MTV from using its TV clout to crush a groundswell of rivals on the Web. Digital technology has spawned numerous music sites, from homegrown fan pages to sophisticated sites backed by the record companies themselves. They let fans listen to music, watch performances and buy tunes via the Web. And record industry executives want to make sure the sites thrive in the new wired world -- before MTV can dominate it. As for the Web, MTV hasn't asked for exclusivity, an MTV spokeswoman says. In some TV licensing renewal talks, however, the company has requested that competing Web sites not get videos any sooner than MTV's cable channel does, a person familiar with the discussions says. The record companies are eagerly signing licensing deals with MTV's Web rivals, executives say, but want richer licensing fees from the Web than those negotiated by MTV for television. The Justice Department began scrutinizing the music-video powerhouse, a unit of Viacom Inc., several months ago. The agency started looking into MTV's competitive practices in television when MTV acquired rival TV channel The Box in a deal with Liberty Digital, a unit of Liberty Media Corp. In addition to bringing a rival into the MTV fold, the deal also beefed up MTV's Web presence by linking its music sites with Liberty Digital's music sites, such as sonicnet.com and streamland.com.
2000^"Currently only a handful of companies offer broadband service. But Jupiter Communications, a New York market-research firm, estimates 2.8 million North American households will have cable modems by year end, with an additional one million or so DSL households. And there is still considerable room for growth: More than 48 million North American homes have cable-modem service available to them, while about half as many homes are within reach of DSL service from Bell Atlantic, SBC Communications and BellSouth Corp. By 2003, Jupiter estimates, 7.7 million households will use cable modems, compared with 5.7 million households for DSL.  Bell Atlantic -- which will become Verizon after its merger with GTE Corp. -- introduced its DSL service in October 1998, beginning in the Pittsburgh and Washington metro areas. By early May, the company had equipped more than 900 of its 2,500 central offices for DSL, and more than 19 million of the 44 million lines in its service area were ready for the service. Bell Atlantic began offering DSL service in New York last July, though the roll-out really gathered speed late last winter. Today, only a handful of the central offices serving the metro area aren't DSL-ready. At the end of May, Bell Atlantic had about 70,000 consumer DSL customers.  Meanwhile, Bell Atlantic and the Baby Bells are working on technological solutions to extend the range of DSL. At the same time, they're looking beyond DSL entirely. Mr. [Jeff Waldhuter] calls DSL ""an interim technology"" that he expects will be around for 15 years -- during which time Bell Atlantic will bring super-fast fiber-optic lines directly to more customers."
2000^Strategic Advantages: Disney acquired Infoseek and created the Go Network Internet portal to try to turn itself into an online competitor of AOL, Yahoo and other Web titans. The Go Network includes key Disney properties like ESPN.com, Disney.com and ABCNEWS.com. Go.com's advantage is the strength of its individual sites. ESPN.com, for example, is the longtime leader in online sports news.
2004^"""The only reason it didn't succeed was broadband,"" says Mark Davis, managing partner of the venture-backed company practice at consultancy Deloitte &amp; Touche, which advised Mibrary. ""It came to the point of saying, 'This idea is just too early.' It would be perfect right now."" The Web casts, provided by Sportsline.com Inc. for a $9.95 subscription and free for AOL's three million high-speed subscribers, may not have been possible as recently as a year ago, says FeedRoom President and Chief Executive Jon Klein. ""We would have had far fewer viewers,"" says Mr. Klein, who in 1998 left his job as a senior executive overseeing CBS's 60 Minutes to start FeedRoom. ""There's now a critical mass of viewers for marketers to reach."" Another dot-com era media start-up company benefiting from the surge in broadband is the NewsMarket, a video-archive and distribution platform that allows the news media to access free broadcast-standard video over the Internet. ""The digital newsroom, [powered by] broadband, is transforming how the broadcast media operates,"" says Anthony Hayward, co-founder and chairman of the NewsMarket. ""Those same technologies are transforming how . . . companies are communicating. We sit right in the middle of that opportunity."""
2005^"Mr. [Jordan Golson]'s site -- at jlgolson.blogspot.com -- is just one of dozens of locations on the Internet hosting amateur videos of the Indian Ocean disaster. Many have been deluged with visitors eager to see more of the gripping footage than TV offers, or to watch videos over and over again on their own time. Some of these ""video blogs,"" like Mr. Golson's, are pre-existing text blogs, which typically include commentary and views on current events. Others have just sprung up in the last week. WaveofDestruction.org, created by an Australian blogger to host tsunami videos, logged 682,366 unique visitors from last Wednesday through Sunday morning, and has more than 25 amateur videos of the impact so far. Last year, video bloggers already showed their muscle by rapidly distributing a clip of singer Ashlee Simpson caught lip synching on ""Saturday Night Live,"" and another of the Daily Show's Jon Stewart clashing with the hosts of CNN's ""Crossfire."" According to Andreas Wacker, founder of blogsnow.com, a site that ranks blogs, the Crossfire video was downloaded by more people on the Internet than saw it on TV. ""When the Internet wants to see something, it sees it,"" he says. Bloggers don't charge for access, but they haven't been paying for copyrighted footage, either. And bloggers seldom ask each other for permission. ""The law really hasn't caught up,"" says Mr. Golson. ""The rule of thumb is you can take stuff as long as you say where you got it from,"" and as long as you don't sell it, he adds."
2005^"All of this is free to anyone with a taste for videos and an idea of where to find them. While many of the major search engines such as Google and Yahoo have video search sections, the results are often cluttered with extraneous material, just as they can be for text searches. It usually makes more sense to look for videos on a Web site that focuses on your topic: Go to a news network's site for the latest videos from the war in Iraq, a music site for the latest video from your favorite artist, a sports site for clips from last night's games, etc. To help you explore the expanding world of online videos, here's a sampling of some good places to start looking: Reuters also serves up a wide selection of video on topics such as world news, business and entertainment at TV.Reuters.com. Its popular ""Oddly Enough"" section offers funny and strange videos, such as a mouse riding a surfboard in Australia, or a man who repairs computers using his feet. Selecting any of the topic ""channels"" on the site's main page -- including ""Top News"" for the latest developments -- allows visitors to scroll through a listing of every video in that section. Video blogging isn't only for the personal or experimental. Some newspapers, such as the Spokesman Review, based in Spokane, Wash., are getting their feet wet with vlogs. As reporter Colin Mulvany explains on the site (SpokesmanReview.com/blogs/video), ""I want to tell stories the local TV news stations, with their breathless reporters, doing live standups of stale stories, fail to do anymore."" His almost daily vlogs touch on ""great little stories that go unnoticed each day,"" such as a profile of a Native American Vietnam veteran, a fire that ruined a local resident's home, and the prerelease party for the newest Harry Potter book."
2005^"""If you launch a channel of any kind and the content is popular, people will sponsor it,"" says a spokesman for for TiVo Inc., which has explored new forms of advertising. ""With vlogs the jury is still out."" For Mr. [Steve Garfield], vlogging is an easy outlet for his creative side. It's unlikely a major network would pick up ""The Carol and Steve Show,"" but the Internet allows him to broadcast his show as much as he wants along with other videos that teach would-be vloggers basic video techniques, as well a show he narrates called ""Vlog Soup"" pointing out his top picks among new vlogs. ""It's part of the democratization of media,"" says Mr. Garfield. ""It gives people the tools to express themselves and be creative in all different ways."""
2006^"IT MIGHT NOT qualify as an art form, but it's a format that's on the rise on the Internet: the fake movie trailer that twists an existing movie into a completely different genre. Through incongruous music and editing tricks, ""Psycho"" appears to be a romantic comedy and ""West Side Story"" looks like a slasher flick. The clips have become calling cards of sorts for artists and editors hoping to get noticed. Patrick De Nicola, a 21-year-old junior at Boston's Emerson College, says he's been fielding emails from television networks and comedy clubs since putting one online two weeks ago."
2006^The explosive growth of Internet video is allowing people not only to find an audience for their amateur productions. Now they can actually earn money from them. San Diego-based Eefoof Inc., launched just over a week ago, shares 50% of its profits from text ads and banner ads with users who upload their own online video clips. Shares are distributed based on the number of hits a particular video receives. Recently launched Panjea.com, operated by Aware Media Inc., shares 50% of revenue from the ads appearing on profile pages to which users can upload their own video and audio files. Users can also sell their content via download at a price they set, in which case they earn 85% of the sale. In May, Blip Networks Inc.'s Blip.TV began giving members half of the ad revenue it earns from the still- photograph and video ads that users can have placed at the end of their videos. Revver affixes an ad frame to the end of a video clip and gives the users 50% of the revenue generated when the ad is clicked on, whether the video is accessed from a Web site, shared across instant-messaging services or emailed between friends. Watching online video, from comedy skits to failed cooking experiments, is fast becoming a favorite Internet amusement. Nearly one-quarter of Internet users watch online video at least once a week, according to the Online Publishers Association. To date, video sites have typically relied on members' good will and boredom to stock up on inventory that is funny, fresh and contagious. Now new sites hope that dangling cash perks before video uploaders will help them win traffic from more established players like YouTube and Google Video while helping creators share in the success of these sites. Using an ad- sharing service doesn't prevent filmmakers from also posting their clips on YouTube. YouTube did not answer repeated requests for comment.
2006^"The two see branching out beyond ""Ninja"" as key to long-term success. ""'Ask a Ninja' was always kind of a proof of concept for us,"" says Mr. Nichols. ""We've looked at others who have been successful but they didn't know how to work with new talent and bring fresh ideas into the fold. Dick Clark makes more money in his sleep producing things than he ever does on camera."" EMMY-NOMINATED PODCASTERS Orrin and Jerry Zucker, ""It s Jerry Time"" itsjerrytime.com The Zucker brothers (no relation to the writer-director brothers behind films such as ""Airplane!"") were among the only amateurs nominated for the first ""iPod Emmy,"" awarded this year to shows made for portable players (AOL won for its ""Live 8 concert broadcasts last summer). Their sitcom-like video podcast uses collage-style animation to recount Jerry's day-to-day exploits. VIDEO PODCAST STARS Kent Nichols and [Douglas Sarine] ""Ask a Ninja,"" askaninja.com Some episodes of this video podcast, which features weekly monologues from a sarcastic ninja character, have had close to 1 million views on YouTube. Made by Mr. Nichols and Mr. Sarine, it regularly tops the iTunes podcast charts, and has inspired dozens of amateurs to make their own ninja tribute videos. They ve recently launched another show, ""Hope is [Emo],"" which stars a young woman and has risen to the top 25 on iTunes in part because of its affiliation with ""Ask a Ninja."""
2006^"Then there is Bree, known as ""lonelygirl15"" on Youtube. She might be everything she appears to be -- a sweet, wide-eyed, intelligent-sounding teenager -- but YouTubers have their doubts. Her videos have been among the most watched and most discussed on YouTube for months now. Many of these exchanges -- posted in a comment section on the site -- center on a picture of famed 20th-century occultist and practitioner of ""black magic"" Aleister Crowley that can be seen hanging on the wall of her room. Is Bree a satanist? YouTubers have even been led to question whether Bree herself isn't someone's invention -- an actress with a script -- and whether her travails are luring viewers in to some darker plot point in the future. The cynicism and skepticism of our age, then, are still there. But watching YouTube is not like watching a polished movie because we don't know where we stand. The result is what one might call interactive entertainment on steroids. Viewers are not only trying to anticipate or even influence the next plot twist within a YouTube auteur's own terms. They are often busily trying to determine whether those terms should be accepted in the first place. One YouTuber has gone so far as to create a character he named ""BreesFather,"" who offers monologues in the guise of Bree's (supposedly) Satan-loving father. Thus he has made himself part of Bree's story, at least as experienced by YouTubers. He's not ""real,"" of course. But whether he's any less real than renetto or Bree herself is hard to tell."
2006^The agreement, to take effect before the end of the year, illustrates YouTube's push to tackle the thorny copyright issues facing it and other sites that allow users to upload video content. YouTube is developing an automated system to digitally identify copyrighted music and video uploaded by its users. It will then give a percentage of revenue from any ads that appear alongside those videos on YouTube's Web site, if their owners have agreements with YouTube and opt for that rather than having the videos removed.
2006^"YouTube's new system is the latest attempt by an online startup to transition from disputed copyright practices to a less-controversial business model. TV and movie companies are just starting to come to grips with how to manage video-sharing technology. There are signs they could be interested in cutting deals: Several TV executives say they have been in talks with YouTube and other video sites about ways to make some content freely available. General Electric Co.'s NBC Universal signed an advertising and content deal with YouTube in June. YouTube's agreement with Warner hinges on a digital system YouTube is developing to identify automatically copyrighted music or other audio, and related video its users upload. The system relies partly on what's known as ""fingerprinting"" -- comparing audio uploaded to the site to unique attributes of copyrighted content it already knows. YouTube's planned system is similar in some respects to one proposed last year by an online music startup, Snocap Inc., which was launched by Shawn Fanning, the founder of Napster. Snocap is seeking to help peer-to-peer music services and other online outlets become legitimate music distributors. YouTube said the audio-identification system could potentially be used to locate non-music content such as video clips from TV shows, and that it could eventually use video-identification technology as well. YouTube currently faces legal challenges. Robert Tur, the owner of Los Angeles News Service, named YouTube in a complaint filed in July in U.S. District Court in Los Angeles. He alleges copyright infringement in connection with several videos that were available through YouTube. YouTube has said Mr. Tur's suit is ""without merit."" A similar case, which an adult-entertainment company, Io Group Inc., brought against a video-sharing site, Veoh Networks Inc., in June in U.S. District Court for California's Northern District, makes a similar claim. A ruling against Veoh could potentially set a precedent affecting YouTube."
2006^"Much as with pitching traditional journalists, the key with blogging is to have something to say beyond just ""buy my product."" Mark Hughes, author of ""Buzzmarketing,"" calls this ""story wrapping."" Says Mr. Hughes: ""No one is going to talk about the guy who cleans gutters because there is no inherent story value. But they might talk about the guy who cleans gutters who wears a tuxedo."" It paid off. In recent months, Gopher State Taxi has routinely popped first on Google's sponsored link for core keywords, including: ""Minneapolis, airport, taxi."" Mr. [Kenny Kormendy] says his business has grown to a network of nearly three dozen cabs and he is off welfare. He estimates his total payout to Google is about $175 to $205 monthly, based on how many clicks his ads get. ""People with cellphones on planes can find me,"" he says. ""Almost every time I ask someone, they tell me it was on the Internet. And nine times out of 10 it's from Google. I don't have $50,000 to compete with [bigger taxi companies]. But with what I create off the Internet, I can blow them away."" Beyond that, it's critical to make your Web site search-friendly, or search-optimal, for certain keywords. In the early days, search optimization was largely a matter of inserting enough important keywords into your Web site that it would become visible to search engines. In some cases, this still works. Mr. Hughes, the author of ""Buzzmarketing,"" also does speaking for a living. He wanted to pit himself as a viable alternative for people looking to book Malcolm Gladwell, the best-selling author of ""The Tipping Point"" and ""Blink."" So Mr. Hughes created a Web page within his own site, buzzmarketing.com, that compares ""Speaker Malcolm Gladwell vs. Business Speaker Mark Hughes."" By using the words ""Malcolm Gladwell speaker"" roughly every 300 words on that page, a link to his comparison is now usually among those that pop up on the first search page of Google when you type the words: ""Malcolm Gladwell speaker."" Soon after that page went up, Mr. Hughes says, he got a $17,000 speaking gig from a company that located him that way. (Says Mr. Gladwell of Mr. Hughes's efforts: ""How could I not be flattered?"")"
2006^"The U.N. has enlisted the star of hugely popular Web video series LonelyGirl15 and other Web video makers to participate in an ad campaign promoting an antipoverty event it plans Sunday. Jessica Lee Rose, the teenage actress who plays ""Bree"" in Lonelygirl15 videos posted on video-sharing Web site YouTube, will reprise the role that made her famous, sitting in a bedroom by herself, talking into a camera. But this time, rather than talking about a boy, ""Bree"" makes a plea for the antipoverty cause. The Lonelygirl's antipoverty video, like those made by other amateur video makers, has been posted on YouTube. The U.N. hopes the videos will spark buzz about its call for people around the world to ""stand up against poverty"" at rallies and other events planned for a 24-hour period Sunday. The online videos are part of a broader ad campaign, designed by WPP Group's ad agency Y&amp;R, also involving television. The ad is the first marketing pitch to make use of the LonelyGirl15 character but it may not be the last, Mr. [Greg Goodfried] said. After being approached by Y&amp;R about two weeks ago, the group agreed to participate in the ad because it was ""a really good cause"" and the issue of poverty ""is something that needs more attention,"" says Ms. Rose, the actress appearing in the ad. Mr. Goodfried says they are open to more marketing alliances but says they wouldn't want to let ""Bree"" become ""overcommercialized."""
2006^"Moreover, [Google]'s huge investment in a site exclusively devoted to video (the YouTube acquisition is the largest in the company's history), is seen as a sign that Google has ambitions to dominate the field of video search much in the way it has done text. That's likely to set off a race among Google's competitors to stake out the market -- often deploying cutting-edge technology that they hope will give them an edge. ""Google's acquisition of YouTube marks a turning point,"" says Tim Tuttle, vice president of AOL Video, who says AOL is now trying to carve out its own niche in the space by searching across as many different sources of video as possible -- not just those it hosts. U.S. Internet users streamed more than seven billion videos in July, according to comScore Networks Inc. MySpace.com captured the largest share, followed by Yahoo and YouTube. But when measured by overall traffic, YouTube holds the top spot, with 46% of visits among the top sites tracked by market researcher Hitwise. ""There is no Google or Yahoo of video search,"" says Brian Haven, an analyst at market researcher Forrester Research. ""But with the content exploding and the momentum so strong, there is no way around it happening."" Other technologies that are still being tested include facial-recognition software and the ability to tag different frames in a clip to help search within videos. People who upload videos have their own complaints. Kevin Nalty, a health-care marketer from Doylestown, Pa., says figuring out which of his videos will show up where is a guessing game because the sites are ""bloated"" with inventory. As a result, the 39-year-old tries to label his videos with as many peripherally related words he can think of, including misspellings. By labeling one recent video documenting his attempt to tape wheels onto his daughter's sneakers with the word ""Healies"" -- a misspelling of ""Heelys,"" the popular sneakers with retractable wheels -- he was able to climb higher in various video- search results."
2006^"""When trying to use any virtual technology in the political space, one still has to remember how people think in the real world. Something that doesn't work in the real world probably won't work just because technology is cool. In 2004, everyone was obsessed with Howard Dean's campaign's Internet strategy. It wasn't a new technology so much as a way to tap into Americans' desire to feel included in the political process. 'What Americans Know' is the definitive text on how to understand the American voter. I often go back and reread this key book for insights into the thought process of the voters."" That said, I don't think the risk is too great. YouTube is far different from Napster or Grokster. The core idea of YouTube is that a user creates a work on their own and then shares it online. The thrust of the business is not to encourage anyone to violate copyright, but rather to create works that they then can distribute online. The business model that YouTube features is a far cry from any of the early music file-sharing businesses. That difference in business model should make a big difference in terms of the copyright risk calculus. MR. [Stan Liebowitz]: Although the purpose of YouTube might be to encourage home-grown creative endeavors, some portion of YouTube files have been pure copyrighted files with no home-grown component, although it appears that YouTube has taken them down when requested."
